{
  "procedure": {
    "doc_id": "epa_field_operations_manual_filter_sampling_sop",
    "title": "5.14 Repair",
    "version": "CASTNET FOM",
    "domain": "field_operations",
    "source": {
      "doc_id": "epa_field_operations_manual_filter_sampling_sop",
      "section": "5.14",
      "page": null,
      "char_start": 601180,
      "char_end": 612180
    }
  },
  "steps": [
    {
      "id": "S1",
      "label": "",
      "action_verb": "",
      "action_object": "",
      "arguments": [],
      "parameters": [],
      "constraints": [],
      "flags": {},
      "provenance": {
        "doc_id": "epa_field_operations_manual_filter_sampling_sop",
        "section": "5.14"
      }
    }
  ],
  "constraints": [],
  "relations": [],
  "quality": {
    "annotation_scope": "full_subprocedure",
    "review_status": "reviewed",
    "annotator": "<YOUR_HANDLE>",
    "review_date": "<YYYY-MM-DD>",
    "review_notes": "Independent second-pass annotation for IAA. Authored WITHOUT reading datasets/paper/gold/<doc>.json (anchoring control). Same source span as the first pass (see procedure.source char range / _source/<doc>.txt)."
  }
}