{
  "procedure": {
    "doc_id": "nasa_npr_8715_3d_general_safety",
    "title": "2.5.2 System Safety Technical Plan (SSTP)",
    "version": "NASA NPR 8715.3D",
    "domain": "safety_requirements",
    "source": {
      "doc_id": "nasa_npr_8715_3d_general_safety",
      "section": "2.5.2 (SSTP)",
      "page": null,
      "char_start": 50391,
      "char_end": 54798
    }
  },
  "steps": [
    {
      "id": "S1",
      "label": "",
      "action_verb": "",
      "action_object": "",
      "arguments": [],
      "parameters": [],
      "constraints": [],
      "flags": {},
      "provenance": {
        "doc_id": "nasa_npr_8715_3d_general_safety",
        "section": "2.5.2 (SSTP)"
      }
    }
  ],
  "constraints": [],
  "relations": [],
  "quality": {
    "annotation_scope": "full_subprocedure",
    "review_status": "reviewed",
    "annotator": "<YOUR_HANDLE>",
    "review_date": "<YYYY-MM-DD>",
    "review_notes": "Independent second-pass annotation for IAA. Authored WITHOUT reading datasets/paper/gold/<doc>.json (anchoring control). Same source span as the first pass (see procedure.source char range / _source/<doc>.txt)."
  }
}