{
  "procedure": {
    "doc_id": "epa_field_sampling_measurement_procedure_validation",
    "title": "EPA LSASD non-standard procedure validation excerpt",
    "version": "LSASDPROC-012-R6",
    "domain": "field_procedure_validation",
    "source": {
      "doc_id": "epa_field_sampling_measurement_procedure_validation",
      "page": "4-6",
      "section": "3.2.1-5.1"
    }
  },
  "steps": [
    {
      "id": "S1",
      "label": "Inform the customer in writing that a non-standard procedure will be used",
      "action_verb": "inform",
      "action_object": "customer",
      "arguments": [],
      "parameters": [],
      "constraints": [
        {
          "id": "C1",
          "type": "precondition",
          "text": "When it is necessary to use a non-standard sampling or measurement procedure, the project leader will take this action.",
          "attached_to": [
            "S1"
          ]
        },
        {
          "id": "C2",
          "type": "requirement",
          "text": "Notification must be in writing (email or memo).",
          "attached_to": [
            "S1"
          ]
        }
      ],
      "flags": {
        "safety_critical": false
      },
      "provenance": {
        "doc_id": "epa_field_sampling_measurement_procedure_validation",
        "page": "4",
        "section": "3.2.1"
      }
    },
    {
      "id": "S2",
      "label": "Document that the customer agrees with the non-standard procedure",
      "action_verb": "document",
      "action_object": "customer agreement",
      "arguments": [],
      "parameters": [],
      "constraints": [
        {
          "id": "C3",
          "type": "documentation",
          "text": "Document that the customer agrees with the use of a non-standard procedure.",
          "attached_to": [
            "S2"
          ]
        }
      ],
      "flags": {
        "safety_critical": false
      },
      "provenance": {
        "doc_id": "epa_field_sampling_measurement_procedure_validation",
        "page": "4",
        "section": "3.2.1"
      }
    },
    {
      "id": "S3",
      "label": "Document the customer request and need in the project file",
      "action_verb": "document",
      "action_object": "project file justification",
      "arguments": [],
      "parameters": [],
      "constraints": [
        {
          "id": "C4",
          "type": "documentation",
          "text": "Document in the project file the customer's request and the need for using a non-standard procedure (description of the project request and why it required the use of a non-standard procedure).",
          "attached_to": [
            "S3"
          ]
        },
        {
          "id": "C5",
          "type": "requirement",
          "text": "Non-standard procedures will be fully validated according to Section 4 of this procedure.",
          "attached_to": [
            "S3"
          ]
        },
        {
          "id": "C6",
          "type": "requirement",
          "text": "If the non-standard procedure is not adopted into the scope of the FSB quality system prior to use, any results generated must be clearly identified as being outside the scope of the quality system in the field investigation report.",
          "attached_to": [
            "S3"
          ]
        },
        {
          "id": "C7",
          "type": "requirement",
          "text": "If FSB choose to include the non-standard procedure in the scope of their quality system, this will be done in accordance with the LSASD Operating Procedure for Document Control (LSASDPROC-1000, most recent version).",
          "attached_to": [
            "S3"
          ]
        }
      ],
      "flags": {
        "safety_critical": false
      },
      "provenance": {
        "doc_id": "epa_field_sampling_measurement_procedure_validation",
        "page": "4",
        "section": "3.2.1-3.2.3"
      }
    },
    {
      "id": "S4",
      "label": "Develop a validation plan with objective acceptance criteria and testing scope",
      "action_verb": "develop",
      "action_object": "validation plan",
      "arguments": [],
      "parameters": [],
      "constraints": [
        {
          "id": "C8",
          "type": "definition",
          "text": "Validation is the confirmation by examination and the provision of objective evidence that particular requirements for a specific intended use are fulfilled.",
          "attached_to": [
            "S4"
          ]
        },
        {
          "id": "C9",
          "type": "role_assignment",
          "text": "LSASD FSB management will designate members of the validation team and ensure the team has the necessary resources to complete the validation.",
          "attached_to": [
            "S4"
          ]
        },
        {
          "id": "C10",
          "type": "requirement",
          "text": "The validation team will develop an appropriate field test or evaluation for the operating procedure.",
          "attached_to": [
            "S4"
          ]
        },
        {
          "id": "C11",
          "type": "requirement",
          "text": "After completion of the field test or evaluation, the validation team will assess the results against the acceptance criteria.",
          "attached_to": [
            "S4"
          ]
        },
        {
          "id": "C12",
          "type": "requirement",
          "text": "If the assessment indicates that the operating procedure meets the acceptance criteria, the procedure is accepted for use.",
          "attached_to": [
            "S4"
          ]
        },
        {
          "id": "C13",
          "type": "documentation",
          "text": "The validation team will document all decisions and actions and maintain records of validation.",
          "attached_to": [
            "S4"
          ]
        },
        {
          "id": "C14",
          "type": "role_assignment",
          "text": "The validation team leader will be responsible for maintaining the records during the validation effort.",
          "attached_to": [
            "S4"
          ]
        }
      ],
      "flags": {
        "safety_critical": false
      },
      "provenance": {
        "doc_id": "epa_field_sampling_measurement_procedure_validation",
        "page": "5",
        "section": "4.1.1-4.6.2"
      }
    },
    {
      "id": "S5",
      "label": "Provide documented training before staff implement the accepted operating procedure",
      "action_verb": "provide",
      "action_object": "staff training",
      "arguments": [],
      "parameters": [],
      "constraints": [
        {
          "id": "C15",
          "type": "precondition",
          "text": "After a standard or nonstandard procedure has been assessed and accepted for use, staff training must occur before implementation.",
          "attached_to": [
            "S5"
          ]
        },
        {
          "id": "C16",
          "type": "postcondition",
          "text": "Document competency for each staff member assigned to implement the procedure.",
          "attached_to": [
            "S5"
          ]
        }
      ],
      "flags": {
        "safety_critical": false
      },
      "provenance": {
        "doc_id": "epa_field_sampling_measurement_procedure_validation",
        "page": "6",
        "section": "5.1"
      }
    }
  ],
  "constraints": [],
  "relations": [],
  "quality": {
    "annotation_scope": "bounded_excerpt",
    "review_status": "reviewed",
    "annotator": "imad",
    "review_date": "2026-06-13",
    "review_notes": "Second-pass review. Expanded constraints to capture 3.2.1-3.2.3 (notification format, validation per Section 4, FSB scope inclusion via LSASDPROC-1000) and 4.1.1-4.6.2 (validation definition, team designation, field test development, assessment, acceptance, documentation, leader responsibility). Total: 5 steps, 16 constraints (was 5 steps, 4 constraints). All constraint text source-derived. Step structure kept at 5 (informing/agreement/documentation/validation/training) — defensible alternative would have been to split S4 into 5 sub-steps for sections 4.1-4.5 but that fragments the validation lifecycle."
  }
}
