{
  "procedure": {
    "doc_id": "olsk_small_cnc_v1_workbook",
    "title": "OLSK Small CNC electronic box assembly excerpt",
    "version": "V1",
    "domain": "assembly_workbook",
    "source": {
      "doc_id": "olsk_small_cnc_v1_workbook",
      "page": "worksheet excerpt",
      "section": "01.1-01.4"
    }
  },
  "steps": [
    {
      "id": "S1",
      "label": "Assemble the electronic box top and bottom frame",
      "action_verb": "assemble",
      "action_object": "electronic box frame",
      "arguments": [],
      "parameters": [
        {"name": "Profile 20-400", "quantity": 8},
        {"name": "Bracket 20", "quantity": 8},
        {"name": "Hammer Nut M5", "quantity": 16},
        {"name": "C-screw M5-8", "quantity": 16}
      ],
      "constraints": [
        {
          "id": "C1",
          "type": "tolerance",
          "text": "Not necessary to be absolutely precise.",
          "attached_to": [
            "S1"
          ]
        }
      ],
      "flags": {
        "safety_critical": false
      },
      "provenance": {
        "doc_id": "olsk_small_cnc_v1_workbook",
        "section": "01.1"
      }
    },
    {
      "id": "S2",
      "label": "Install the electronic box bottom panel",
      "action_verb": "install",
      "action_object": "bottom panel",
      "arguments": [],
      "parameters": [
        {"name": "Box Bottom Panel", "quantity": 1},
        {"name": "Hammer Nut M5", "quantity": 6},
        {"name": "C-screw M5-8", "quantity": 6},
        {"name": "Red Dot Sticker", "quantity": 1},
        {"name": "Prepared Bottom Frame (Step 01.1)", "quantity": 1}
      ],
      "constraints": [
        {
          "id": "C2",
          "type": "precondition",
          "text": "Remove protective foils.",
          "attached_to": [
            "S2"
          ]
        },
        {
          "id": "C3",
          "type": "warning",
          "text": "Pay attention to top and bottom of the panel.",
          "attached_to": [
            "S2"
          ]
        },
        {
          "id": "C4",
          "type": "requirement",
          "text": "Mark the front with the Red Dot Sticker.",
          "attached_to": [
            "S2"
          ]
        }
      ],
      "flags": {
        "safety_critical": false
      },
      "provenance": {
        "doc_id": "olsk_small_cnc_v1_workbook",
        "section": "01.2"
      }
    },
    {
      "id": "S3",
      "label": "Mount the motor drivers and motor power supply in the electronic box",
      "action_verb": "mount",
      "action_object": "drivers and power supply",
      "arguments": [],
      "parameters": [
        {"name": "Motor Driver", "quantity": 3},
        {"name": "Motor Power Supply", "quantity": 1},
        {"name": "C-screw M4-12", "quantity": 6},
        {"name": "C-screw M4-8", "quantity": 4},
        {"name": "Lock Nut M4", "quantity": 6}
      ],
      "constraints": [
        {
          "id": "C5",
          "type": "warning",
          "text": "Pay attention to position of motor drivers and motor power supply.",
          "attached_to": [
            "S3"
          ]
        }
      ],
      "flags": {
        "safety_critical": false
      },
      "provenance": {
        "doc_id": "olsk_small_cnc_v1_workbook",
        "section": "01.3"
      }
    },
    {
      "id": "S4",
      "label": "Attach the vertical profiles to the prepared top and bottom frame",
      "action_verb": "attach",
      "action_object": "vertical profiles",
      "arguments": [],
      "parameters": [
        {"name": "Profile 20-150", "quantity": 4},
        {"name": "Bracket 20", "quantity": 8},
        {"name": "Hammer Nut M5", "quantity": 16},
        {"name": "C-screw M5-8", "quantity": 16},
        {"name": "Prepared Top Frame (Step 01.1)", "quantity": 1}
      ],
      "constraints": [
        {
          "id": "C6",
          "type": "order",
          "text": "Attach brackets first to the vertical profiles, then to the top and bottom.",
          "attached_to": [
            "S4"
          ]
        },
        {
          "id": "C7",
          "type": "postcondition",
          "text": "The final tightening of the screws should be all together at the end.",
          "attached_to": [
            "S4"
          ]
        }
      ],
      "flags": {
        "safety_critical": false
      },
      "provenance": {
        "doc_id": "olsk_small_cnc_v1_workbook",
        "section": "01.4"
      }
    }
  ],
  "constraints": [],
  "relations": [],
  "quality": {
    "annotation_scope": "bounded_excerpt",
    "review_status": "reviewed",
    "annotator": "imad",
    "review_date": "2026-06-13",
    "review_notes": "Second-pass review. S2.C3 split into C3 (panel orientation warning) + C4 (red dot marking requirement) — original draft conflated two distinct workbook notes. All constraint wording updated to exact source text. Parameters populated from parts-list table. C1 type changed warning -> tolerance (more accurate semantic). IAA NOTE: second_pass annotation missed C1 (precision tolerance) and the red-dot/orientation pair (now C3/C4) — likely because annotator B treated workbook table cells as parts-list captions rather than constraints. This is the κ=0.531 cause. Re-annotate second_pass to match this review for IAA recomputation."
  }
}
